{
  "schemaVersion": 1,
  "documentStatus": "template-not-validated",
  "environment": {
    "osVersion": null,
    "osBuild": null,
    "architecture": null,
    "xcodeVersion": null,
    "swiftCompiler": null,
    "sdkVersion": null
  },
  "defaultMutationEnabled": false,
  "knownConstraints": [
    {
      "id": "MACOS27-TCC-READ",
      "description": "macOS 27+ baseline does not use direct TCC database access. This constraint is documentary evidence, not a completed integration test.",
      "sourceID": "S03"
    },
    {
      "id": "OWN-SERVICES-ONLY",
      "description": "SMAppService is not a universal manager of arbitrary third-party applications.",
      "sourceID": "S02"
    },
    {
      "id": "NO-SCOPE-ESCALATION",
      "description": "No global reset may substitute for selected-entry cleanup.",
      "sourceID": "S01 / project policy"
    }
  ],
  "verifiedProfiles": []
}
